{
  "protocol": "crdd-ir/traceability-v0.1",
  "operation": "PlaceWall",
  "source": {
    "path": "examples/place-wall/05_SPEC/01_Behavior_Specification.md",
    "irSha256": "1fc7e43e67b3c08e3c047f18b0707ce705e3eca9dfd4ff5c7380a7e9bb9ae9cd"
  },
  "generatedFiles": [
    {
      "path": "unreal/PlaceWall.generated.h",
      "sha256": "1758106f98246e1f645f829ff01d342fdf3c4961cddbfbb59971acb4efcad0d9",
      "traces": [
        "REQ-WALL-001",
        "DEC-WALL-003"
      ]
    },
    {
      "path": "unreal/PlaceWall.generated.cpp",
      "sha256": "d78e9c18758b43dc34e6d84b4105f33d109353d1eeb62ad77974603ba543a51f",
      "traces": [
        "REQ-WALL-001",
        "DEC-WALL-003"
      ]
    },
    {
      "path": "assets/WallPreview.generated.obj",
      "sha256": "1aa038429906fc0e614a0c625033686f35f19b9cf47426e90eae2ba122e3c752",
      "traces": [
        "REQ-WALL-001"
      ]
    },
    {
      "path": "assets/WallPreview.generated.mtl",
      "sha256": "1607240ad13b4560495b8b431245f3bdb8ff49a88f924a0cc1a9d94b623d9e30",
      "traces": [
        "REQ-WALL-001"
      ]
    },
    {
      "path": "assets/assets.manifest.json",
      "sha256": "98de4b09c1a5f3d08292866b3454728122e7515dfbd275995a70a4b12c6e379f",
      "traces": []
    }
  ],
  "requirements": [
    {
      "id": "minimum-wall-length",
      "error": "WALL_TOO_SHORT",
      "traces": [
        "REQ-WALL-001"
      ],
      "testCases": [
        "minimum-wall-length-at-boundary",
        "minimum-wall-length-below-boundary"
      ]
    },
    {
      "id": "sufficient-budget",
      "error": "INSUFFICIENT_BUDGET",
      "traces": [
        "DEC-WALL-003"
      ],
      "testCases": [
        "sufficient-budget-exact",
        "sufficient-budget-insufficient"
      ]
    }
  ],
  "conformance": {
    "protocol": "crdd-ir/conformance-v0.1",
    "sha256": "def53a693f5af925966c530a1d5684a34448bca0c5a19b1075af45060607e3c1",
    "cases": [
      {
        "id": "place-wall-success",
        "traces": [
          "REQ-WALL-001",
          "DEC-WALL-003"
        ]
      },
      {
        "id": "minimum-wall-length-at-boundary",
        "sourceRequirement": "minimum-wall-length",
        "traces": [
          "REQ-WALL-001"
        ]
      },
      {
        "id": "minimum-wall-length-below-boundary",
        "sourceRequirement": "minimum-wall-length",
        "traces": [
          "REQ-WALL-001"
        ]
      },
      {
        "id": "sufficient-budget-exact",
        "sourceRequirement": "sufficient-budget",
        "traces": [
          "DEC-WALL-003"
        ]
      },
      {
        "id": "sufficient-budget-insufficient",
        "sourceRequirement": "sufficient-budget",
        "traces": [
          "DEC-WALL-003"
        ]
      }
    ]
  },
  "execution": {
    "path": "unreal-execution.json",
    "sha256": "caf15f2cb96ac6dc51019c0cd90cc1263aa5164404fec9c8bb26a520903cf910",
    "status": "passed",
    "tests": [
      "CRDD.Assets.WallPreview",
      "CRDD.Assets.WallPreviewLevel",
      "CRDD.PlaceWall.Conformance"
    ]
  }
}
